{
  "name": "API/Service Name",
  "description": "This is a service/API description.",
  "proxy": {
    "useProxy": false,
    "host": "host",
    "port": "8080",
    "username": "user",
    "password": "pass"
  },
  "requests": [
    {
      "id": "request-form",
      "endPoint": "get?id=value&user&key=value",
      "method": "GET",
      "requestData": {
        "queryParameters": {
          "key": "value",
          "key2": "value2"
        },
        "formParameters": {
          "formKey": "formValue",
          "formKey2": "formValue2"
        },
        "headers": {
          "header1": "header-value-1",
          "header2": "header-value-2"
        }
      }
    }
  ]
}
