{
  "name": "API/Service Name",
  "description": "This is a service/API description.",
  "proxy": {
    "useProxy": false,
    "host": "91.224.62.194",
    "port": "8080",
    "username": "az",
    "password": "xz"
  },
  "requests": [
    {
      "id": "request-1",
      "endPoint": "{{ENV::endpoint}}",
      "method": "POST",
      "requestData": {
        "queryParameters": {
          "key": "value",
          "key2": "value2"
        },
        "headers": {
          "header1": "{{ENV::env1}}",
          "header2": "{{ENV::env2}}"
        },
        "body": {
          "test": {
            "name": "Kamar",
            "phone": "123456"
          },
          "array": [
            {
              "t1": "{{ENV::env3}}"
            }
          ]
        }
      }
    }
  ]
}
